{
  "$schema": "https://json-schema.org/draft/2020-12/schema",
  "$id": "https://contracts.porter.invalid/v1/destination.schema.json",
  "title": "Destination",
  "description": "One route to a conversation. The locator kind is the destination kind.",
  "type": "object",
  "additionalProperties": false,
  "required": ["id", "conversationId", "deviceId", "identityEpoch", "locator", "capabilities", "lastVerifiedAt", "revision"],
  "properties": {
    "id": { "$ref": "common.schema.json#/$defs/uuid" },
    "conversationId": { "$ref": "common.schema.json#/$defs/uuid" },
    "deviceId": { "$ref": "common.schema.json#/$defs/uuid" },
    "connectorId": { "$ref": "common.schema.json#/$defs/opaqueId" },
    "identityEpoch": { "$ref": "common.schema.json#/$defs/opaqueId" },
    "locator": {
      "oneOf": [
        { "$ref": "#/$defs/browserTab" },
        { "$ref": "#/$defs/desktopLink" },
        { "$ref": "#/$defs/mobileLink" }
      ]
    },
    "capabilities": { "type": "array", "maxItems": 16, "items": { "$ref": "common.schema.json#/$defs/capability" } },
    "lastVerifiedAt": { "$ref": "common.schema.json#/$defs/timestamp" },
    "revision": { "$ref": "common.schema.json#/$defs/revision" }
  },
  "if": { "properties": { "locator": { "type": "object", "properties": { "kind": { "const": "browserTab" } } } } },
  "then": { "required": ["connectorId"] },
  "$defs": {
    "browserTab": {
      "type": "object",
      "additionalProperties": false,
      "required": ["kind", "connectorId", "connectionEpoch", "tabId"],
      "properties": {
        "kind": { "const": "browserTab" },
        "connectorId": { "$ref": "common.schema.json#/$defs/opaqueId" },
        "connectionEpoch": { "$ref": "common.schema.json#/$defs/opaqueId" },
        "tabId": { "type": "integer", "minimum": 0 },
        "windowIdHint": { "type": "integer", "minimum": 0 },
        "canonicalUrl": { "$ref": "common.schema.json#/$defs/httpsUrl" }
      }
    },
    "desktopLink": {
      "type": "object",
      "additionalProperties": false,
      "required": ["kind", "bundleId", "deepLink"],
      "properties": {
        "kind": { "const": "desktopLink" },
        "bundleId": { "$ref": "common.schema.json#/$defs/bundleId" },
        "deepLink": { "$ref": "common.schema.json#/$defs/deepLink" },
        "accountScopeId": { "$ref": "common.schema.json#/$defs/uuid" }
      }
    },
    "mobileLink": {
      "type": "object",
      "additionalProperties": false,
      "required": ["kind", "url"],
      "properties": {
        "kind": { "const": "mobileLink" },
        "url": { "anyOf": [{ "$ref": "common.schema.json#/$defs/httpsUrl" }, { "$ref": "common.schema.json#/$defs/deepLink" }] },
        "accountRequirement": { "$ref": "common.schema.json#/$defs/label" }
      }
    }
  }
}
